document_file,document_title,image_file,image_reference_type,image_reference_line,detected_image_type,has_interactive_buttons,interactive_buttons_magenta,hard_fail_triggered,hard_fail_reason,score_topic_match,score_detail_match,score_section_relevance,score_visual_evidence,score_contradictions,overall_score,final_verdict,processing_error,api_http_status,api_finish_reason,api_attempt,match_reasons,missing_evidence
umn/source/instances/logging_in_to_a_windows_ecs/logging_in_to_a_windows_ecs_using_vnc.rst,Logging In to a Windows ECS Using VNC,/home/ubuntu/repotesting/elastic-cloud-server/umn/source/_static/images/en-us_image_0030874275.png,substitution_image,437,icon,False,False,False,,3,3,3,3,3,1.00,pass,,200,completed,1,"Image displays a magnifying glass icon, corresponding to |image4| used for searching ECS instances. | Matches the visual representation of the search function.",
umn/source/instances/managing_gpu_drivers_of_gpu-accelerated_ecss/obtaining_a_tesla_driver_and_cuda_toolkit.rst,Obtaining a Tesla Driver and CUDA Toolkit,,,,,,,,,,,,,,,fail,backend_error,500,,2,,
umn/source/instances/managing_my_ecss/changing_ecs_names.rst,Changing ECS Names,/home/ubuntu/repotesting/elastic-cloud-server/umn/source/_static/images/en-us_image_0000002385172005.png,figure,31,screenshot,True,False,True,Interactive button (pencil icon) is not magenta or plain white.,3,3,3,3,3,1.00,fail,,200,completed,1,"Image shows the ECS details page with the pencil icon highlighted, matching the instruction to click next to the ECS name. | Illustrates the editing step for changing the ECS name.",
umn/source/instances/managing_my_ecss/changing_ecs_names.rst,Changing ECS Names,/home/ubuntu/repotesting/elastic-cloud-server/umn/source/_static/images/en-us_image_0000002188678994.png,substitution_image,38,icon,False,False,False,,3,3,3,3,3,1.00,pass,,200,completed,1,"Icon is a location pin, matching the instruction to select a region and project. | Clearly represents region selection.",
umn/source/instances/managing_my_ecss/changing_ecs_names.rst,Changing ECS Names,/home/ubuntu/repotesting/elastic-cloud-server/umn/source/_static/images/en-us_image_0000001710878525.png,substitution_image,39,icon,False,False,False,,3,3,3,3,3,1.00,pass,,200,completed,1,"Icon is a pencil, matching the instruction to click next to the ECS name to edit it. | Clearly represents the edit action.",
umn/source/instances/managing_my_ecss/changing_ecs_names.rst,Changing ECS Names,/home/ubuntu/repotesting/elastic-cloud-server/umn/source/_static/images/en-us_image_0000001705857469.png,substitution_image,40,icon,False,False,False,,3,3,3,3,3,1.00,pass,,200,completed,1,"Icon is a checkmark, matching the instruction to click after editing the name. | Clearly represents confirmation or saving the change.",
umn/source/instances/managing_my_ecss/managing_ecs_status.rst,Managing ECS Status,/home/ubuntu/repotesting/elastic-cloud-server/umn/source/_static/images/en-us_image_0000002188678994.png,substitution_image,88,icon,False,False,False,,3,3,3,3,3,1.00,pass,,200,completed,1,"The image displays a location pin icon, which directly corresponds to the RST instruction to click it for region and project selection. | The icon is a standard UI symbol for location/region, matching the context perfectly. | No contradictions or missing visual evidence are present.",
umn/source/instances/managing_my_ecss/obtaining_metadata_and_passing_user_data/injecting_user_data.rst,Injecting User Data,/home/ubuntu/repotesting/elastic-cloud-server/umn/source/_static/images/en-us_image_0000002352286882.png,figure,56,screenshot,True,True,False,,3,3,3,3,3,1.00,pass,,200,completed,2,"Image shows the UI for injecting user data, matching the text description of pasting content or uploading a file. | Tabs and text box align with the documented steps for configuring user data.",
umn/source/instances/managing_my_ecss/obtaining_metadata_and_passing_user_data/injecting_user_data.rst,Injecting User Data,/home/ubuntu/repotesting/elastic-cloud-server/umn/source/_static/images/en-us_image_0115931570.png,figure,133,screenshot,False,False,False,,3,3,3,3,3,1.00,pass,,200,completed,2,Terminal screenshot shows the /etc/hosts file updated with the IP and domain from the Cloud-Config script example. | Matches the expected output described in Example 2.,
umn/source/instances/managing_my_ecss/obtaining_metadata_and_passing_user_data/injecting_user_data.rst,Injecting User Data,/home/ubuntu/repotesting/elastic-cloud-server/umn/source/_static/images/en-us_image_0115932123.png,figure,179,screenshot,False,False,False,,3,3,3,3,3,1.00,pass,,200,completed,2,"Windows File Explorer screenshot shows the created text file '1111' with the expected content 'Hello, BAT Test'. | Directly illustrates the result of the batch-processing script example.",
umn/source/instances/managing_my_ecss/obtaining_metadata_and_passing_user_data/injecting_user_data.rst,Injecting User Data,/home/ubuntu/repotesting/elastic-cloud-server/umn/source/_static/images/en-us_image_0115932873.png,figure,187,screenshot,False,False,False,,3,3,3,3,3,1.00,pass,,200,completed,2,Browser screenshot shows the metadata service endpoint returning the batch script content. | Matches the documented method for viewing injected user data on Windows ECS.,
umn/source/instances/managing_my_ecss/obtaining_metadata_and_passing_user_data/injecting_user_data.rst,Injecting User Data,/home/ubuntu/repotesting/elastic-cloud-server/umn/source/_static/images/en-us_image_0115933029.png,figure,204,screenshot,False,False,False,,3,3,3,3,3,1.00,pass,,200,completed,2,"Windows File Explorer screenshot shows the created text file 'aaaa' with the expected content 'Hello, Powershell Test'. | Directly illustrates the result of the PowerShell script example.",
umn/source/instances/managing_my_ecss/obtaining_metadata_and_passing_user_data/injecting_user_data.rst,Injecting User Data,/home/ubuntu/repotesting/elastic-cloud-server/umn/source/_static/images/en-us_image_0115934291.jpg,figure,212,screenshot,False,False,False,,3,3,3,3,3,1.00,pass,,200,completed,2,Browser screenshot shows the metadata service endpoint returning the PowerShell script content. | Matches the documented method for viewing injected user data on Windows ECS.,
umn/source/instances/managing_my_ecss/obtaining_metadata_and_passing_user_data/obtaining_ecs_details_using_metadata.rst,Obtaining ECS Details Using Metadata,/home/ubuntu/repotesting/elastic-cloud-server/umn/source/_static/images/en-us_image_0166755236.png,figure,227,screenshot,False,False,False,,3,3,3,3,3,1.00,pass,,200,completed,1,"The image is a terminal screenshot showing a curl command to the OpenStack metadata user_data endpoint. | The output displays an HTML page with '404 Not Found', which directly corresponds to the RST note explaining that querying user_data without prior configuration returns a 404 error. | The image is correctly positioned and captioned as Figure 1 in the documentation.",
umn/source/instances/reinstalling_or_changing_the_os/reinstalling_the_os.rst,Reinstalling the OS,/home/ubuntu/repotesting/elastic-cloud-server/umn/source/_static/images/en-us_image_0000002524673400.png,figure,56,screenshot,True,True,False,,3,3,3,3,3,1.00,pass,,200,completed,2,"The image is a screenshot of the 'Reinstall OS' configuration dialog. | It directly corresponds to the Procedure section, specifically steps 4 through 9. | Visible UI elements like the 'Encrypted' checkbox, 'Key Pair' dropdown, and 'OK' button match the documented options. | The 'OK' button is magenta, satisfying the mandatory color rule for interactive buttons.",
umn/source/instances/reinstalling_or_changing_the_os/reinstalling_the_os.rst,Reinstalling the OS,/home/ubuntu/repotesting/elastic-cloud-server/umn/source/_static/images/en-us_image_0000002188678994.png,substitution_image,110,icon,False,False,False,,3,2,3,2,3,0.88,pass,,200,completed,2,"The image is a small location pin icon. | It matches the reference in step 2 of the Procedure ('Click |image1| in the upper left corner and select a region and project'). | The icon semantically represents region/project selection in cloud management consoles. | Low visual detail due to its small size, but contextually accurate.","The icon lacks surrounding UI context, making it purely symbolic without explicit labels."
umn/source/instances/viewing_ecs_information/viewing_failed_tasks.rst,Viewing Failed Tasks,/home/ubuntu/repotesting/elastic-cloud-server/umn/source/_static/images/en-us_image_0000002385194877.png,figure,44,screenshot,True,False,False,,3,3,3,3,3,1.00,pass,,200,completed,1,Image shows the 'Failures' button in the UI as described in the procedure. | Clearly depicts the interactive element mentioned in step 4.,
umn/source/instances/viewing_ecs_information/viewing_failed_tasks.rst,Viewing Failed Tasks,/home/ubuntu/repotesting/elastic-cloud-server/umn/source/_static/images/en-us_image_0000002188678994.png,substitution_image,54,icon,False,False,False,,2,2,3,3,3,0.83,pass,,200,completed,1,Image is a location pin icon used to represent region selection. | Matches the context of selecting a region and project in step 2.,
umn/source/instances/viewing_ecs_information/viewing_the_ecs_creation_status.rst,Viewing the ECS Creation Status,/home/ubuntu/repotesting/elastic-cloud-server/umn/source/_static/images/en-us_image_0000001705420301.png,figure,25,screenshot,True,False,False,,3,3,3,3,3,1.00,pass,,200,completed,1,"The image clearly shows the ECS list interface with the 'Start', 'Stop', 'Restart', and 'Delete' buttons and the '1 Creating' status indicator, directly illustrating step 4 of the procedure.",
umn/source/instances/viewing_ecs_information/viewing_the_ecs_creation_status.rst,Viewing the ECS Creation Status,/home/ubuntu/repotesting/elastic-cloud-server/umn/source/_static/images/en-us_image_0000002188678994.png,substitution_image,46,icon,False,False,False,,3,3,3,3,3,1.00,pass,,200,completed,1,"The image displays a location pin icon, which matches the region selection button referenced in step 2 of the procedure.",
umn/source/passwords_and_key_pairs/key_pairs/creating_a_key_pair_using_putty_key_generator.rst,Creating a Key Pair Using PuTTY Key Generator,/home/ubuntu/repotesting/elastic-cloud-server/umn/source/_static/images/en-us_image_0000001234512206.png,figure,33,screenshot,True,False,True,"Screenshot contains interactive UI buttons that are gray, not magenta or plain white, with no magenta elements present.",3,3,3,3,3,1.00,fail,,200,completed,1,"Image shows the PuTTY Key Generator interface as described in step 2a. | Red box highlights the 'Generate' button, matching the procedure.",
umn/source/passwords_and_key_pairs/key_pairs/creating_a_key_pair_using_putty_key_generator.rst,Creating a Key Pair Using PuTTY Key Generator,/home/ubuntu/repotesting/elastic-cloud-server/umn/source/_static/images/en-us_image_0000001278632153.png,figure,44,screenshot,True,False,True,"Screenshot contains interactive UI buttons that are gray, not magenta or plain white, with no magenta elements present.",3,3,3,3,3,1.00,fail,,200,completed,1,"Image displays the generated public key area, matching step 2b. | Red box correctly highlights the public key content.",
umn/source/passwords_and_key_pairs/key_pairs/creating_a_key_pair_using_putty_key_generator.rst,Creating a Key Pair Using PuTTY Key Generator,/home/ubuntu/repotesting/elastic-cloud-server/umn/source/_static/images/en-us_image_0000001278352685.png,figure,68,screenshot,True,False,True,"Screenshot contains interactive UI buttons that are gray, not magenta or plain white, with no magenta elements present.",3,3,3,3,3,1.00,fail,,200,completed,1,"Image shows the 'File' menu with 'Save private key' highlighted, matching step 4a. | Visual evidence aligns with the instruction to save the private key.",
umn/source/passwords_and_key_pairs/key_pairs/creating_a_key_pair_using_putty_key_generator.rst,Creating a Key Pair Using PuTTY Key Generator,/home/ubuntu/repotesting/elastic-cloud-server/umn/source/_static/images/en-us_image_0000001278751917.png,figure,86,screenshot,True,False,True,"Screenshot contains interactive UI buttons that are gray, not magenta or plain white, with no magenta elements present.",3,3,3,3,3,1.00,fail,,200,completed,1,"Image shows the 'Conversions' menu with 'Export OpenSSH key' highlighted, matching step 5a. | Visual evidence aligns with the instruction for Xshell/Windows ECS scenarios.",
umn/source/passwords_and_key_pairs/key_pairs/importing_a_key_pair.rst,Importing a Key Pair,/home/ubuntu/repotesting/elastic-cloud-server/umn/source/_static/images/en-us_image_0000002351719638.png,figure,37,screenshot,True,True,False,,3,3,3,3,3,1.00,pass,,200,completed,1,"The image displays the 'Import Key Pair' dialog box exactly as described in step 5 of the procedure. | It shows the 'Select File', 'OK', and 'Cancel' buttons, with the 'OK' button being magenta, which complies with the mandatory color rule.",
umn/source/passwords_and_key_pairs/key_pairs/importing_a_key_pair.rst,Importing a Key Pair,/home/ubuntu/repotesting/elastic-cloud-server/umn/source/_static/images/en-us_image_0000002188678994.png,substitution_image,67,icon,False,False,False,,2,2,3,2,3,0.78,partial,,200,completed,1,"The image shows a location pin icon, which aligns with the instruction in step 2 to click an icon in the upper left corner to select a region and project. | As an icon, it lacks detailed UI elements but correctly represents the interactive element mentioned in the text.",
umn/source/passwords_and_key_pairs/password_reset/obtaining_and_deleting_the_password_for_logging_in_to_a_windows_ecs/deleting_the_password_for_logging_in_to_a_windows_ecs.rst,Deleting the Password for Logging In to a Windows ECS,/home/ubuntu/repotesting/elastic-cloud-server/umn/source/_static/images/en-us_image_0000002351571222.png,figure,35,screenshot,True,True,False,,3,3,3,3,3,1.00,pass,,200,completed,1,"The image shows the 'More' dropdown menu in the Operation column. | The 'Delete Password' option is highlighted in magenta, directly matching the procedure step.",
umn/source/passwords_and_key_pairs/password_reset/obtaining_and_deleting_the_password_for_logging_in_to_a_windows_ecs/deleting_the_password_for_logging_in_to_a_windows_ecs.rst,Deleting the Password for Logging In to a Windows ECS,/home/ubuntu/repotesting/elastic-cloud-server/umn/source/_static/images/en-us_image_0000002188678994.png,substitution_image,42,icon,False,False,False,,2,1,2,1,3,0.60,partial,,200,completed,1,The image displays a location pin icon. | It corresponds to the upper-left corner button referenced in step 2 for selecting a region and project.,The image is low resolution and shows only the isolated icon without surrounding UI context.
umn/source/passwords_and_key_pairs/password_reset/obtaining_and_deleting_the_password_for_logging_in_to_a_windows_ecs/obtaining_the_password_for_logging_in_to_a_windows_ecs.rst,Obtaining the Password for Logging In to a Windows ECS,/home/ubuntu/repotesting/elastic-cloud-server/umn/source/_static/images/en-us_image_0000002385408725.png,figure,36,screenshot,True,True,False,,3,3,3,3,3,1.00,pass,,200,completed,1,"The image is a screenshot of the management console UI showing a server list. | It clearly displays the 'More' dropdown menu with the 'Get Password' option highlighted in magenta, directly matching the documentation instructions.",
umn/source/passwords_and_key_pairs/password_reset/obtaining_and_deleting_the_password_for_logging_in_to_a_windows_ecs/obtaining_the_password_for_logging_in_to_a_windows_ecs.rst,Obtaining the Password for Logging In to a Windows ECS,/home/ubuntu/repotesting/elastic-cloud-server/umn/source/_static/images/en-us_image_0000002188678994.png,substitution_image,79,icon,False,False,False,,2,2,2,2,3,0.72,partial,,200,completed,1,"The image is a small, low-resolution gray icon resembling a location pin. | It corresponds to the `|image1|` reference in the text, which instructs users to click it to select a region and project.","The surrounding UI context is not visible, making it difficult to verify the exact placement or label."
umn/source/passwords_and_key_pairs/password_reset/resetting_the_password_of_a_linux_ecs_by_attaching_a_system_disk_to_a_temporary_ecs.rst,Resetting the Password of a Linux ECS by Attaching a System Disk to a Temporary ECS,/home/ubuntu/repotesting/elastic-cloud-server/umn/source/_static/images/en-us_image_0000001384584706.png,figure,70,screenshot,False,False,False,,3,3,3,3,3,1.00,pass,,200,completed,1,"The image shows the terminal output of the `fdisk -l` command, which directly corresponds to the instruction in step 5.b to view the directory of the attached system disk.",
umn/source/passwords_and_key_pairs/password_reset/resetting_the_password_of_a_linux_ecs_by_attaching_a_system_disk_to_a_temporary_ecs.rst,Resetting the Password of a Linux ECS by Attaching a System Disk to a Temporary ECS,/home/ubuntu/repotesting/elastic-cloud-server/umn/source/_static/images/en-us_image_0000002188678994.png,substitution_image,127,icon,False,False,False,,3,3,3,3,3,1.00,pass,,200,completed,1,"The image displays a location pin icon, which matches the UI element described in step 2.b for selecting a region and project in the management console.",
umn/source/passwords_and_key_pairs/password_reset/resetting_the_password_of_a_windows_ecs_by_attaching_a_system_disk_to_a_temporary_ecs.rst,Resetting the Password of a Windows ECS by Attaching a System Disk to a Temporary ECS,/home/ubuntu/repotesting/elastic-cloud-server/umn/source/_static/images/en-us_image_0000002188678994.png,substitution_image,148,icon,False,False,False,,2,2,3,3,3,0.83,pass,,200,completed,1,"The image displays a location pin icon, which semantically matches the RST instruction to click it for selecting a region and project. | The icon is clearly isolated and functions as a standard UI pictogram for navigation. | No contradictions are present between the image and the procedural text.",The surrounding management console interface or the dropdown menu that appears after clicking is not visible.
umn/source/resources_and_tags/quota_adjustment.rst,Quota Adjustment,/home/ubuntu/repotesting/elastic-cloud-server/umn/source/_static/images/en-us_image_0275513364.png,substitution_image,49,icon,False,False,False,,3,3,3,3,3,1.00,pass,,200,completed,1,"The image displays a location pin icon, which corresponds to the RST instruction to click it for selecting a region and project.",
umn/source/resources_and_tags/quota_adjustment.rst,Quota Adjustment,/home/ubuntu/repotesting/elastic-cloud-server/umn/source/_static/images/en-us_image_0152727234.png,substitution_image,50,icon,False,False,False,,3,3,3,3,3,1.00,pass,,200,completed,1,"The image shows a bar chart icon, which aligns with the RST context of accessing the Quotas page to view resource usage.",
umn/source/resources_and_tags/tag_management/adding_tags_to_an_ecs.rst,Adding Tags to an ECS,/home/ubuntu/repotesting/elastic-cloud-server/umn/source/_static/images/en-us_image_0000002385495189.png,figure,40,screenshot,False,False,False,,3,3,3,3,3,1.00,pass,,200,completed,1,Shows the tag input fields during ECS creation. | Matches the RST step for adding tags during creation.,
umn/source/resources_and_tags/tag_management/adding_tags_to_an_ecs.rst,Adding Tags to an ECS,/home/ubuntu/repotesting/elastic-cloud-server/umn/source/_static/images/en-us_image_0000002385415681.png,figure,65,screenshot,True,True,False,,3,3,3,3,3,1.00,pass,,200,completed,1,Shows the Tags tab and Add Tag button. | Matches the RST instructions for editing tags on the ECS details page.,
umn/source/resources_and_tags/tag_management/adding_tags_to_an_ecs.rst,Adding Tags to an ECS,/home/ubuntu/repotesting/elastic-cloud-server/umn/source/_static/images/en-us_image_0210875481.png,substitution_image,127,icon,False,False,False,,2,2,2,1,3,0.67,partial,,200,completed,1,Generic location pin icon. | Used in RST to represent region selection.,Lacks UI context.
umn/source/resources_and_tags/tag_management/adding_tags_to_an_ecs.rst,Adding Tags to an ECS,/home/ubuntu/repotesting/elastic-cloud-server/umn/source/_static/images/en-us_image_0210875480.png,substitution_image,128,icon,False,False,False,,2,2,2,1,3,0.67,partial,,200,completed,1,Generic gear icon. | Used in RST to represent editing a tag key.,Lacks UI context.
umn/source/resources_and_tags/tag_management/adding_tags_to_an_ecs.rst,Adding Tags to an ECS,/home/ubuntu/repotesting/elastic-cloud-server/umn/source/_static/images/en-us_image_0210875480.png,substitution_image,128,icon,False,False,False,,2,2,2,1,3,0.67,partial,,200,completed,1,Generic plus icon. | Used in RST to represent adding a tag value.,Lacks UI context.
umn/source/resources_and_tags/tag_management/deleting_tags.rst,Deleting Tags,/home/ubuntu/repotesting/elastic-cloud-server/umn/source/_static/images/en-us_image_0000002188678994.png,substitution_image,79,icon,False,False,False,,3,3,3,3,3,1.00,pass,,200,completed,1,"The image displays a location pin icon, which semantically matches the instruction to select a region and project.",
umn/source/resources_and_tags/tag_management/deleting_tags.rst,Deleting Tags,/home/ubuntu/repotesting/elastic-cloud-server/umn/source/_static/images/en-us_image_0210875481.png,substitution_image,80,icon,False,False,False,,3,3,3,3,3,1.00,pass,,200,completed,1,"The image shows a settings gear icon, which aligns with the action of selecting target tag keys in the UI.",
umn/source/resources_and_tags/tag_management/deleting_tags.rst,Deleting Tags,/home/ubuntu/repotesting/elastic-cloud-server/umn/source/_static/images/en-us_image_0210875482.png,substitution_image,81,icon,False,False,False,,3,3,3,3,3,1.00,pass,,200,completed,1,"The image displays an 'X' icon, which is a standard symbol for delete or close actions, matching the context of deleting a tag.",
umn/source/resources_and_tags/tag_management/deleting_tags.rst,Deleting Tags,/home/ubuntu/repotesting/elastic-cloud-server/umn/source/_static/images/en-us_image_0210875483.png,substitution_image,83,icon,False,False,False,,3,3,3,3,3,1.00,pass,,200,completed,1,"The image shows a circular arrow refresh icon, which corresponds to the instruction to refresh the search results area.",
umn/source/resources_and_tags/tag_management/deleting_tags.rst,Deleting Tags,/home/ubuntu/repotesting/elastic-cloud-server/umn/source/_static/images/en-us_image_0210875483.png,substitution_image,83,icon,False,False,False,,3,3,3,3,3,1.00,pass,,200,completed,1,"The image displays a refresh icon, matching the step to refresh the resource tag list in the batch deletion process.",
umn/source/resources_and_tags/tag_management/searching_for_resources_by_tag.rst,Searching for Resources by Tag,/home/ubuntu/repotesting/elastic-cloud-server/umn/source/_static/images/en-us_image_0000002385499469.png,figure,26,screenshot,True,True,False,,3,3,3,3,3,1.00,pass,,200,completed,2,"The image shows the Elastic Cloud Server interface with the 'Tag' option selected in the search filter dropdown, directly illustrating the RST step for searching by tag. | The magenta 'Create ECS' button is visible, satisfying the interactive button color rule.",
umn/source/resources_and_tags/tag_management/searching_for_resources_by_tag.rst,Searching for Resources by Tag,/home/ubuntu/repotesting/elastic-cloud-server/umn/source/_static/images/en-us_image_0000002385424557.png,figure,32,screenshot,True,True,False,,3,3,3,3,3,1.00,pass,,200,completed,2,"The image displays the search results after applying a tag filter, consistent with the RST description of searching by tag key-value pair. | The magenta 'Create ECS' button is present, satisfying the interactive button color rule.",
umn/source/resources_and_tags/tag_management/searching_for_resources_by_tag.rst,Searching for Resources by Tag,/home/ubuntu/repotesting/elastic-cloud-server/umn/source/_static/images/en-us_image_0000002188678994.png,substitution_image,50,icon,False,False,False,,3,3,3,3,3,1.00,pass,,200,completed,2,"The image is a location pin icon, which corresponds to the region selector icon mentioned in the RST step 2. | Matches the definition of |image1| in the RST document.",
umn/source/security/hss.rst,HSS,/home/ubuntu/repotesting/elastic-cloud-server/umn/source/_static/images/en-us_image_0000002188678994.png,substitution_image,71,icon,False,False,False,,3,3,3,3,3,1.00,pass,,200,completed,1,"The image shows a location pin icon, which directly corresponds to the text instruction for selecting a region.",
umn/source/security/hss.rst,HSS,/home/ubuntu/repotesting/elastic-cloud-server/umn/source/_static/images/en-us_image_0000002039480781.png,substitution_image,72,icon,False,False,False,,3,3,3,3,3,1.00,pass,,200,completed,1,"The image shows a question mark icon, which aligns with the instruction to hover for additional information or troubleshooting details.",
umn/source/service_overview/ecs_types_and_specifications/ecs_specifications/ultra-high_i_o_ecss.rst,Ultra-high I/O ECSs,/home/ubuntu/repotesting/elastic-cloud-server/umn/source/_static/images/en-us_image_0000001347858206.png,figure,310,screenshot,False,False,False,,3,3,3,3,3,1.00,pass,,200,completed,2,Matches RST Figure 1 showing `df -Th` output for querying mount points on Linux ECS. | Highlights the mount point `/mnt/nvme0` as described in the text.,
umn/source/service_overview/ecs_types_and_specifications/ecs_specifications/ultra-high_i_o_ecss.rst,Ultra-high I/O ECSs,/home/ubuntu/repotesting/elastic-cloud-server/umn/source/_static/images/en-us_image_0000001347546258.png,figure,378,screenshot,False,False,False,,3,3,3,3,3,1.00,pass,,200,completed,2,Matches RST Figure 2 showing `ll /dev/disk/by-id/` output for querying serial numbers on Linux ECS. | Highlights the NVMe disk ID as described in the text.,
